stock_id,stock_name,risk,roi,sharpe_ratio,correlation_to_hsi,PE_ratio,var
000001.SS,SSE Composite Index,34.83267439247275,1.5351599742554314,0.04407241192445377,1.0,0,-1.9790232452378338
601328.SS,"Bank of Communications Co., Ltd.",32.93976744156152,83.09634242310841,2.5226754430045606,0.4490349236811033,6.35,-1.8714774732791033
601899.SS,Zijin Mining Group Company Limited,90.72564556525529,352.8414515638701,3.8891037849941283,0.524063344733524,18.51,-5.154590184199262
688012.SS,Advanced Micro-Fabrication Equipment Inc. China,130.88050787509425,84.68968363783935,0.6470763676945914,0.3652832296443154,53.73,-7.435994276951571
600941.SS,China Mobile Limited,46.36102971302287,96.26320057699711,2.076381848567023,0.2508806120624334,15.84,-3.653522719948693
601728.SS,China Telecom Corporation Limited,50.404995227665836,5.926622206251634,0.11758005688687544,0.2912935148760387,17.24,-3.7160313072435076
601857.SS,PetroChina Company Limited,61.67353885868828,71.93699187068397,1.1664158276292884,0.4195778687698488,9.79,-3.5039906968440624
601166.SS,"Industrial Bank Co., Ltd.",57.90123396340564,13.388937967864711,0.23123752382076523,0.5071154446723943,5.07,-3.289666669013972
600036.SS,"China Merchants Bank Co., Ltd.",63.71232317977839,11.976469164485115,0.18797727922572943,0.5923880208855723,5.74,-3.6198245118994943
603968.SS,"Nantong Acetic Acid Chemical Co., Ltd.",83.24507735833913,-34.546640318043124,-0.414999197722319,0.4407196688779541,-43.48,-4.729580660030387
601658.SS,"Postal Savings Bank of China Co., Ltd.",51.8305053259324,6.686718789828104,0.1290112598320073,0.4071311073633974,5.83,-3.04685884308555
601985.SS,"China National Nuclear Power Co., Ltd.",62.02097758043315,123.8214266264152,1.9964442912212228,0.42776749808395853,19.11,-3.5237304761926564
601288.SS,Agricultural Bank of China Limited,31.362732475098124,79.81752672906795,2.544979994725993,0.3462278264035171,6.54,-1.7818780120945101
688041.SS,"Hygon Information Technology Co., Ltd.",87.05636063066184,22.873083821841515,0.2627388011185188,0.2913528925720523,131.61,-7.825337132291753
601398.SS,Industrial and Commercial Bank of China Limited,32.88950282836635,44.13853521181708,1.3420250054296572,0.3593540155576183,6.18,-1.8686216822822561
601988.SS,Bank of China Limited,32.62904207266213,74.74180254771088,2.2906526762651254,0.3496598647646339,6.38,-1.8538235681838953
600900.SS,"China Yangtze Power Co., Ltd.",41.45059571677382,84.24836535186665,2.0325007130783854,0.27672631458664954,26.05,-2.3550213666676716
600028.SS,China Petroleum & Chemical Corporation,47.72083988784064,85.63973765766856,1.7945982899494133,0.4289000008856621,12.63,-2.711266162230651
600519.SS,"Kweichow Moutai Co., Ltd.",62.782595162376055,54.50553270713087,0.8681631042196005,0.5391619034368119,22.41,-3.567001885148052
601318.SS,"Ping An Insurance (Group) Company of China, Ltd.",57.575107018830444,-41.86755245999817,-0.7271814960987397,0.6438809932165097,8.75,-3.271137721252437
600050.SS,China United Network Communications Limited,63.6928826051834,-8.11615131617725,-0.12742634630759747,0.4847455900251535,16.52,-3.6187199929472382
601668.SS,China State Construction Engineering Corporation Limited,55.98006471949209,22.754346802323262,0.4064723203937323,0.5433626922153895,4.2,-3.180515170943456
601669.SS,"Power Construction Corporation of China, Ltd",79.24166811830989,26.033492532223917,0.3285328685074528,0.48155440966089685,7.94,-4.502126406677681
601628.SS,China Life Insurance Company Limited,78.45439004775116,13.02676272919235,0.1660424957897656,0.5885427119863614,44.01,-4.457397093488958
601633.SS,Great Wall Motor Company Limited,107.25144834558812,199.14628711483454,1.8568167627269772,0.4441432558688915,18.82,-6.093505969992675
601919.SS,"COSCO SHIPPING Holdings Co., Ltd.",101.12102504377486,455.0923682146781,4.500472261012688,0.44317141785993264,8.47,-5.745205116583102
601601.SS,"China Pacific Insurance (Group) Co., Ltd.",74.53074891697507,-14.266976502213923,-0.19142403249036033,0.5976481030401195,9.64,-4.234474876369302
601390.SS,China Railway Group Limited,66.40276271709511,16.509325206608743,0.24862407121441177,0.5159342284290868,4.63,-3.772682208792482
600048.SS,"Poly Developments and Holdings Group Co., Ltd.",81.58188696578792,-25.069651040587065,-0.30729432687797775,0.3992214303308435,8.52,-4.635086266317501
601088.SS,China Shenhua Energy Company Limited,67.52004185265184,215.6300823874294,3.193571515521218,0.36861159384823755,13.69,-3.8361605784339416
600887.SS,"Inner Mongolia Yili Industrial Group Co., Ltd.",61.955335389709965,0.7097972963378518,0.011456596786589918,0.5557161740674081,12.18,-3.5200010059875897
601225.SS,Shaanxi Coal Industry Company Limited,79.86426503120879,261.60574468101,3.2756295269077045,0.38920486487250633,11.78,-4.537499336965989
603288.SS,Foshan Haitian Flavouring and Food Company Ltd.,71.83803637951488,-19.709016404764107,-0.27435349569750034,0.3998313638497882,33.79,-4.081488038656701
600030.SS,CITIC Securities Company Limited,65.27898720520685,1.6370721770773118,0.025078087868169837,0.7343823286659285,14.98,-3.708834746625278
600309.SS,"Wanhua Chemical Group Co., Ltd.",74.64959667035414,91.41953447609067,1.2246487396280392,0.5293969351859997,13.9,-4.241227228024283
600406.SS,"NARI Technology Co., Ltd.",82.33888859204684,148.15928786625204,1.7993841111982514,0.42868894092805665,26.14,-4.678095419108049
600809.SS,"Shanxi Xinghuacun Fen Wine Factory Co.,Ltd.",93.2110453047151,327.3323135527141,3.511733105048184,0.4332572017150834,19.66,-5.295798516430045
688981.SS,Semiconductor Manufacturing International Corporation,72.69206323981548,-41.172214355444034,-0.5663921550777067,0.40542534791673324,76.22,-4.573438222615984
600031.SS,"Sany Heavy Industry Co.,Ltd",82.31422707888869,22.561590888119838,0.27409102519418854,0.6060473873658487,28.41,-4.6766942718044335
603501.SS,"Will Semiconductor Co., Ltd.",107.28939945207911,76.81563117366099,0.71596664317215,0.4488789284425477,121.49,-6.095662167391759
600436.SS,"Zhangzhou Pientzehuang Pharmaceutical., Ltd",79.5893255063403,122.17796533440446,1.5351049221377235,0.47659916466665325,41.77,-4.521878609581733
603259.SS,"WuXi AppTec Co., Ltd.",99.75871894345423,7.873664869952172,0.07892708480363672,0.4275795987914311,14.27,-5.6678055058243455
600438.SS,"Tongwei Co.,Ltd",104.24660318541969,69.12526425668658,0.6630936850166327,0.4761016596175959,20.52,-5.922785273863791
600104.SS,SAIC Motor Corporation Limited,62.36130657012362,-34.49376852494704,-0.5531277393323972,0.5351790010015893,11.26,-3.543066315124716
600276.SS,"Jiangsu Hengrui Medicine Co., Ltd.",73.00124318608434,-4.961939798514054,-0.06797062052581469,0.4330935868014099,62.33,-4.147575795321095
600690.SS,"Haier Smart Home Co., Ltd.",74.42257127388238,81.39471644188396,1.0936832072402254,0.5188519131204427,13.79,-4.228328748515801
600089.SS,"TBEA Co., Ltd.",85.84304363910512,202.80709560979565,2.3625338409763526,0.49556195208373954,8.44,-4.877184475977722
600150.SS,China CSSC Holdings Limited,88.47131115104717,76.012245532251,0.8591739462578463,0.40677462997101627,51.35,-5.026509860593057
601012.SS,"LONGi Green Energy Technology Co., Ltd.",99.60013237360087,13.105808903235591,0.13158425185697142,0.4816996636822232,22.47,-5.6587953877786825
601888.SS,China Tourism Group Duty Free Corporation Limited,100.97274007308033,-23.622252624089796,-0.23394683165964283,0.5099588527623315,19.68,-5.736780285327901
688111.SS,"Beijing Kingsoft Office Software, Inc.",124.47050348889908,54.05734558695512,0.4342984407689508,0.368272171197147,62.69,-7.265925569704645
